[
  {"model": "meta-llama/Llama-3.2-3B-Instruct", "provider": "Parasail (via OpenRouter)", "tokenizer_spec": "unsloth/Llama-3.2-3B-Instruct", "input_per_mtok_usd": 0.05, "output_per_mtok_usd": 0.33, "source_url": "https://openrouter.ai/api/v1/models/meta-llama/llama-3.2-3b-instruct/endpoints", "fetched_at": "2026-10-24T15:05:00Z", "verified": true},
  {"model": "meta-llama/Llama-3.2-3B-Instruct", "provider": "Cloudflare (via OpenRouter)", "tokenizer_spec": "unsloth/Llama-3.2-3B-Instruct", "input_per_mtok_usd": 0.0509, "output_per_mtok_usd": 0.335, "source_url": "https://openrouter.ai/api/v1/models/meta-llama/llama-3.2-3b-instruct/endpoints", "fetched_at": "2026-10-24T15:05:00Z", "verified": true},
  {"model": "google/gemma-3-4b-it", "provider": "Parasail (via OpenRouter)", "tokenizer_spec": "unsloth/gemma-3-4b-it", "input_per_mtok_usd": 0.04, "output_per_mtok_usd": 0.05, "source_url": "https://openrouter.ai/api/v1/models/google/gemma-3-4b-it/endpoints", "fetched_at": "2026-10-24T15:08:00Z", "verified": true},
  {"model": "google/gemma-3-4b-it", "provider": "DeepInfra (via OpenRouter)", "tokenizer_spec": "unsloth/gemma-3-4b-it", "input_per_mtok_usd": 0.05, "output_per_mtok_usd": 0.10, "source_url": "https://openrouter.ai/api/v1/models/google/gemma-3-4b-it/endpoints", "fetched_at": "2026-10-24T15:08:00Z", "verified": true},
  {"model": "openai/gpt-oss-20b", "provider": "DeepInfra (via OpenRouter)", "tokenizer_spec": "openai/gpt-oss-20b", "input_per_mtok_usd": 0.03, "output_per_mtok_usd": 0.14, "source_url": "https://openrouter.ai/api/v1/models/openai/gpt-oss-20b/endpoints", "fetched_at": "2026-10-24T15:08:00Z", "verified": true},
  {"model": "openai/gpt-oss-20b", "provider": "Groq (via OpenRouter)", "tokenizer_spec": "openai/gpt-oss-20b", "input_per_mtok_usd": 0.075, "output_per_mtok_usd": 0.30, "source_url": "https://openrouter.ai/api/v1/models/openai/gpt-oss-20b/endpoints", "fetched_at": "2026-10-24T15:08:00Z", "verified": true},
  {"model": "Qwen/Qwen3-4B", "provider": "Fireworks AI (serverless size tier 4B-16B)", "tokenizer_spec": "Qwen/Qwen3-4B", "input_per_mtok_usd": 0.20, "output_per_mtok_usd": 0.20, "source_url": "https://docs.fireworks.ai/serverless/pricing.md", "fetched_at": "2026-10-24T15:20:00Z", "verified": true}
]
